{
  "primitive_id": "present80",
  "primitive_name": "PRESENT-80",
  "family": "spn",
  "source_refs": [
    {
      "kind": "primitive_paper",
      "label": "PRESENT CHES 2007",
      "location": "Section 3, round structure and key schedule",
      "url": "https://www.iacr.org/archive/ches2007/47270450/47270450.pdf"
    },
    {
      "kind": "attack_paper",
      "label": "ePrint 2013/676",
      "location": "Appendix A.1",
      "url": "https://eprint.iacr.org/2013/676"
    }
  ],
  "block_size_bits": 64,
  "key_size_bits": 80,
  "state": {
    "containers": [
      {
        "name": "state",
        "kind": "bitvector",
        "width_bits": 64,
        "count": 1
      },
      {
        "name": "round_key",
        "kind": "bitvector",
        "width_bits": 64,
        "count": 1
      },
      {
        "name": "master_key_register",
        "kind": "bitvector",
        "width_bits": 80,
        "count": 1
      }
    ]
  },
  "round_function": {
    "round_index_origin": 1,
    "round_count_claimed": 31,
    "ops": [
      {
        "op_id": "ark",
        "op_type": "key_add",
        "inputs": [
          "state",
          "round_key"
        ],
        "outputs": [
          "state_after_ark"
        ],
        "params": {
          "mode": "bitwise_xor",
          "width_bits": 64
        },
        "semantic_tags": [
          "xor",
          "state_key_combination"
        ],
        "evidence": [
          "present-ches2007.txt: addRoundKey description"
        ]
      },
      {
        "op_id": "sbox_layer",
        "op_type": "sbox",
        "inputs": [
          "state_after_ark"
        ],
        "outputs": [
          "state_after_sbox"
        ],
        "params": {
          "parallel_count": 16,
          "nibble_width_bits": 4,
          "sbox_hex": [
            "C",
            "5",
            "6",
            "B",
            "9",
            "0",
            "A",
            "D",
            "3",
            "E",
            "F",
            "8",
            "4",
            "7",
            "1",
            "2"
          ]
        },
        "semantic_tags": [
          "nonlinear_layer",
          "parallel_sboxes"
        ],
        "evidence": [
          "present-ches2007.txt: S-box table"
        ]
      },
      {
        "op_id": "player",
        "op_type": "permute_bits",
        "inputs": [
          "state_after_sbox"
        ],
        "outputs": [
          "state"
        ],
        "params": {
          "mapping": [
            0,
            16,
            32,
            48,
            1,
            17,
            33,
            49,
            2,
            18,
            34,
            50,
            3,
            19,
            35,
            51,
            4,
            20,
            36,
            52,
            5,
            21,
            37,
            53,
            6,
            22,
            38,
            54,
            7,
            23,
            39,
            55,
            8,
            24,
            40,
            56,
            9,
            25,
            41,
            57,
            10,
            26,
            42,
            58,
            11,
            27,
            43,
            59,
            12,
            28,
            44,
            60,
            13,
            29,
            45,
            61,
            14,
            30,
            46,
            62,
            15,
            31,
            47,
            63
          ]
        },
        "semantic_tags": [
          "linear_permutation"
        ],
        "evidence": [
          "present-ches2007.txt: pLayer permutation table"
        ]
      }
    ]
  },
  "key_schedule": {
    "modeled": false,
    "notes": "For 80-bit keys, the register is rotated left by 61, the left-most 4 bits pass through the PRESENT S-box, and the round counter is xor-ed into bits k19..k15. The current schema cannot express this key schedule as structured operator-level steps."
  },
  "assumptions": [
    "This file is intentionally marked partial because the related-key target requires a structured key schedule model.",
    "The primitive paper defines 31 rounds plus a final post-whitening addRoundKey.",
    "The selected validation target in this trial uses a 24-round reduced version of PRESENT-80 from the attack paper."
  ]
}
